id|Autor/a|Obra|Fecha de estreno|Dirección|Compañía|Festivales|Lugar de estreno|fechaFormat|lat|lon|uuid
252|Miguel de Cervantes|Rinconete y Cortadillo||Toni Sánchez|Zascandil||||||3fd4e9fa-cfdf-4986-86ee-eb97d6f30de8
253|Miguel de Cervantes|Señor Quijote mío, Don Quijote||Girardo Guerrero|Perro Teatro, A. C||||||210f01cd-397d-4f5e-a70d-021ce292327a
254|Miguel de Cervantes|Don Quijote (Leyenda para cinco voces), Don Quijote|6 de julio de 2004|Felipe B. Pedraza Jiménez|Rapsodas|Festival de Teatro Clásico|Corral de Comedias de Almagro||38.8884394|-3.7119119|3d9c74ec-b831-47c4-9bd6-fa7d74a36905
255|Miguel de Cervantes|El juez de los divorcios ||Domingo Ortega |Grupo de Teatro de la Universidad Carlos III||||||d22ce31a-35fc-4d0b-bbe5-73bf7c3d7f5a
256|Miguel de Cervantes|El retablo de las maravillas ||Domingo Ortega |Grupo de Teatro de la Universidad Carlos III||||||f2813173-a0b6-47b1-b535-4165bae97c66
257|Miguel de Cervantes|El viejo celoso|23 de diciembre de 2004|Etelvino Vázquez|Teatro del Norte||Centro Cultural Cjastur de la Colegiata del San Juan Bautista de Gijón (Asturias)||43.545571|-5.6638903|bd52eb37-b3fd-4a16-b80f-b6a07d04c66b
258|Miguel de Cervantes|El viejo celoso|5 de noviembre de 2004|Manuel Canseco|Asociación de Autores de Teatro|V Salón Internacional del Libro Teatral|Círculo de Bellas Artes||40.4183042|-3.6965333|5395e6a2-3786-4dd8-8f56-e6152963a144
259|Miguel de Cervantes|Exemplaridades cervantinas|23 de enero de 2004|Andrés Cienfuegos|La Quimera||Teatro Bergidu, de Ponferrada (León)||42.5465503|-6.5891852|150670b7-0f29-479b-a6f4-086df946c1e6
260|Miguel de Cervantes|La cueva de Salamanca||J. A. Raynaud|Perséfone||||||c6d68d0a-69c7-4a8e-9bff-459d8dc70508
261|Miguel de Cervantes|La edad de oro, Don Quijote|19 de junio de 2004|Eusebio Lázaro|Compañía Eusebio Lázaro|Festival Clásicos en Alcalá|Corral de Zapateros de Alcalá de Henares (Madrid)||40.4822922|-3.3645504|2eed95c6-4579-4b0e-8104-bbd248d64102
262|Miguel de Cervantes|Don Quijote, La pasión según don Quijote||Emilio Hernández|Sociedad Estatal de Connmemoraciones Culturales, Armonía||Teatro de La Abadía||40.4353022|-3.7094283|4b5ce2a1-ec02-44b2-add5-3049695a6c0a
263|Miguel de Cervantes|Laberinto de amor||Juan Pastor|Guindalera Escena Abierta||||||b87ad798-ba28-478c-a689-b48011e5499f
264|Miguel de Cervantes|Morir cuerdo y vivir loco|13 de enero de 2004|Fernando Fernán Gómez|Centro Dramático de Aragón y Centro Dramático Nacional ||Teatro Principal de Zaragoza||41.6518556|-0.8793213|a5c20e20-d85d-4664-b855-b86bee512e7c
265|Miguel de Cervantes|Pedro de Urdemalas; Pedro, the Great Pretender  |1 de septiembre de 2004 en Inglaterra. 30 de octubre de 2004 en España|Mike Alfreds |Royal Shakespeare Company|Festival de Otoño|En Stratfor-upon-Avon (Inglaterra). Teatro Español de Madrid (España)||46.2651809|-2.7532047|8ade2d6a-e6c4-4bcd-87a4-733aae1784b8
266|Miguel de Cervantes|El retablo de las maravillas. Cinco variaciones sobre un tema de Cervantes|9 de enero de 2004|Alberto Boadella|Els Joglars||Teatro Lope de Vega (Sevilla)||37.3784059|-5.990964|d372cefa-f622-4438-b88d-efd52d84c846
267|Miguel de Cervantes|Cervantes entre palos||Jesús Salgado|Teatro del Duende||||||2948e8df-9c49-412a-8e45-bf7b8d3962c6
268|Miguel de Cervantes|Cervantes insólito|13 de mayo de 2005|María Laura González y Tomás Sendarrubias|Argos Teatro||Teatro Salón Cervantes de Alcalá de Henares (Madrid)||40.4834571|-3.3661106|17514ac9-76ea-47b8-8ae2-923193314150
269|Miguel de Cervantes|Curioso retablo|21 de mayo de 2005|Luis Alonso|Teatro Independiente Alcalaíno TIA, Asociación Cultural||Teatro Salón Cervantes de Alcalá de Henares (Madrid)||40.4834571|-3.3661106|e314c5ff-134c-4dd5-8a5f-5381604797bc
270|Miguel de Cervantes|Don Quijote||Juan Manuel Álvarez|Titirimundi Teatro||||||8595296d-c6d8-4d29-8991-32da0f58b3d5
271|Miguel de Cervantes|Don Quijote ||Jon Sarasti|Galápagos Cálido||||||58a67fe2-432b-4fcb-b969-96aec854a26f
272|Miguel de Cervantes|Don Quixote, Don Quijote|17 de junio de 2005|John Mowat|Companhia do Chapitô||Corral de Zapateros de Alcalá de Henares (Madrid)||40.4822922|-3.3645504|51292222-462a-4678-904e-3dbabb6a6f78
273|Miguel de Cervantes|El caballero de la triste figura ????|20 de marzo de 2005|Marcelo Rocca|El Retablo de la Ventana ||Teatro Juan Bravo (Segovia)||40.9504826|-4.1235423|62490237-67a9-4c84-bbd2-3235a3677208
274|Miguel de Cervantes|El caballeru de la Murnia Figura ????||Inma Rodríguez y Toño Caamaño|Producciones Nun Tris||||||ea93674f-9a7a-4196-ba68-e51211674768
275|Miguel de Cervantes|El casamiento engañoso. El coloquio de los perros||Pepe Ortega|Solo y Cía||||||63ba1ef2-797e-405a-b7ef-7b211cd864fe
276|Miguel de Cervantes|El de la triste figura ????||Juan Margallo|Uroc Teatro||||||97ff1c0c-3920-4d2c-9673-5c266c538fa4
277|Miguel de Cervantes|El desposeído; The Unpossessed||Stacy Klein|Double Edge Theatre||||||b19fbf97-c5ee-43d6-88a5-82028069fd77
278|Miguel de Cervantes|Don Quijote, El Quijote|||La Candelaria ||||||b78055e1-59cf-436a-b9f0-aae698fef9d4
279|Miguel de Cervantes|El viaje del Parnaso|7 de julio de 2005|Eduardo Vasco|Compañía Nacional de Teatro Clásico (CNTC)|Festival Teatro Clásico|Corral de Comedias de Almagro (Ciudad Real)||38.8884394|-3.7119119|d64cfc79-b007-4145-908e-f8b410f282cd
280|Miguel de Cervantes|El retablo de las maravillas|||La Compañía de la ETR||||||1147fe5c-92e9-4516-add5-efc0a29b0697
281|Miguel de Cervantes|El viejo celoso; Entremeses; La cueva de Salamanca; La guarda cuidadosa||Andrés Beladíez|La Barraca||||||243db0af-5488-4147-8b33-b6eb6673348b
282|Miguel de Cervantes|El viejo celoso|||Duelos y Quebrantos||||||56e52bf0-591a-469d-bbc9-8f9db302bad4
283|Miguel de Cervantes|El viejo celoso; La compañía de Saavedra||Asunción Mieres|Aula de Teatro de la UEX|XVI Festival de Teatro Clásico de Cáceres|||||3f487aba-6c4a-4992-857f-47ef88f0191e
284|Miguel de Cervantes|El viejo celoso; La cueva de Salamanca||Miguel Serrano|Teatro para un Instante||Corral del Carbón (Granada)||37.1750505|-3.5981838|779d1f47-d2c2-4d6e-82af-ec5a2afef857
285|Miguel de Cervantes|En un lugar de Sevilla|23 de abril de 2005|José Luis Losa|Edeteatro||Teatro Centro Virgen de los Reyes (Sevilla)||37.40453|-5.9851479|349dc0cb-b41d-497e-834f-7fcd4e1520c0
286|Miguel de Cervantes|Entre pícaros y cómicos|12 de agosto de 2005|Antonoi Barrios|Teatro Par||Casa de las Campanas (Córdoba)||37.8823697|-4.7696905|01b46e78-7b1b-4262-b031-d89067286801
287|Miguel de Cervantes|Entremeses|||Alharaca, Grupo de Teatro||||||0422f438-d004-4e63-84a7-062aedf2214e
288|Miguel de Cervantes|Entremeses: El viejo celoso, La cueva de Salamanca, Los habladores|||La Locandiera||||||aecaf665-f4e1-4a80-bf5d-438d482c7ecd
289|Miguel de Cervantes|Impresión de don Quijote|25 de febrero de 2005|Francisco Plaza|Grupo Sona; Teatro Negro de Praga||Teatro Palacio Valdés de Avilés (Asturias)||43.555218|-5.920094|880f4492-78e8-4cfa-b615-1e23e3f0e5f5
290|Miguel de Cervantes|La columna de El Manco ||Antonia Gómez|Varuma ||||||75c2544d-31df-43ac-940b-96e86cfd8521
291|Miguel de Cervantes|La cueva de Salamanca; La guarda cuidadosa||Arturo Castro|Teatro Margen||||||9456407e-f3f9-4ad1-ab19-fc6b412806c8
292|Miguel de Cervantes|La entretenida |2 de febrero|Helena Pimenta|Compañía Nacional de Teatro Clásico (CNTC)||Teatro Pavón (Madrid)||40.410031|-3.7061552|4de21556-215b-4637-aa36-b2e1cbaf0229
293|Miguel de Cervantes|La Gitanilla |23 de abril de 2005|Paco Macià|Compañía Ferroviaria de Artes Escénicas|Festival Cervantino de Ceutí|Murcia||37.9917074|-1.1394671|c84a5f3e-8feb-4709-a495-eacf15da21bc
294|Miguel de Cervantes|La gracia que no quiso darme el cielo; Miguel de Cervantes, poesía escogida||Joaquín Vida|Joaquín Vida||||||a3dd4d53-3219-4acc-bd02-111fe340a7f0
295|Miguel de Cervantes|La Numancia||Javier Juárez|Kull d´Sac||||||f911d52d-408b-4367-b4ee-9e0b72d7dbcc
296|Miguel de Cervantes|Las hazañas del caballero de La Mancha||Pascual Varo|El Carromato||||||2b1dd448-8c76-44c3-aee6-2930b2436498
297|Miguel de Cervantes|Los habladores|||Jara del Centro Extremeño de Alcalá de Henares. Grupo Teatro La||||||746aedd4-2f75-448b-8ec6-37f754fd88e8
298|Miguel de Cervantes|Mi amigo Don Quijote||Claudia Massotto Franco|Arte Fusión Títeres||||||b55b6bef-845b-4160-a9b5-628f57e7a276
299|Miguel de Cervantes|Don Quijote, Pasajes del Quijote||José Antonio Adamuz|Almocafre||||||2eeb0fb8-34ef-43d3-b620-513b9e2086dc
300|Miguel de Cervantes|¡Quijote!||Cora Herrendorf|Teatro Núcleo||||||d17688fd-b3c9-4e2a-a00a-7a35dedc2467
301|Miguel de Cervantes|Quijote||Marcelo Díaz|Teloncillo, Achiperre||||||fda462d8-e60a-4b55-b152-3131a94b05a6
302|Miguel de Cervantes|Quijote, las mil aventuras|17 de mayo de 2005|Fulgencio Valares |Atakama Teatro||Teatro López de Ayala, Badajoz (Extremadura) ||38.8762766|-6.9723722|ee60c7db-eaf8-45cd-b0e9-0cc1d22757e4
303|Miguel de Cervantes|Quijote, un hidalgo de La Mancha; Quijote. El hidalgo de la Mancha||Wolf Helem y José Vijuesca|Teatro Clásico Madrid Hidra Lerna||||||f23f5aad-a7f0-4aad-a0d8-9b93b7893d1b
304|Miguel de Cervantes|Retablo de maese Pedro o de cómo Ginesillo de Pasamonte conoció a don Quijote y lo que le aconteció|3 de diciembre de 2005|Paco Úbeda|La Tirita de Teatro||||||1a96c02c-1ea4-4e98-86e8-cb9f8313c1d7
305|Miguel de Cervantes|Sancho Panza, el musical|9 de abril de 2005|José Luis Moral|Arte&Ocio||Teatro Nuevo Apolo (Madrid)||40.412189|-3.7033341|ecb5b369-08f5-4458-98ba-89e3342a9703
306|Miguel de Cervantes|Sancho Panza, gobernador de la ínsula Barataria|||Grupo de Teatro Punto y Aparte||||||7b248646-ef6f-41d5-b657-35698580e5ba
307|Miguel de Cervantes|Teatro con clase||Ignacio Almenar|Delirium Teatro||||||b4154533-a28e-4177-881d-4c22d1614d80
308|Miguel de Cervantes|Entremeses||Andreu A. Segura|Rafel Oliver Producciones||||||ace2c5c8-68cd-42f6-b50f-593acc3dd220
309|Miguel de Cervantes|Entremeses ||Domingo Ortega|Grupo de Teatro de las Universidad Carlos III||||||62062144-a8bd-48bd-87da-265aa81818d3
310|Miguel de Cervantes|Entremeses: La cueva de Salamanca, Los habladores y La guarda cuidadosa||Domingo Ortega|Grupo de Teatro de la Universidad Carlos III||||||eb4a5ea5-64c3-42b4-9164-55332e44cfcc
311|Miguel de Cervantes|Don Quixote, Don Quijote|26 de octubre de 2007|Josep Galindo|West Yorkshire Playhouse; Mom|Festival de Otoño|Teatro Madrid||40.4258763|-3.6924628|b3027e1b-bb4f-470c-a6b3-dd667d2ba3db
312|Miguel de Cervantes|El viejo celoso||Margarita Rodríguez |Grupo Cultural Xana||||||e03a3977-8d12-4b6f-88ef-1da89cc09bbc
313|Miguel de Cervantes|Numancia||Ken Kinguuji|Ksec Act||||||bd954a4a-85a7-42ec-a12f-d10882e743c6
314|Miguel de Cervantes|Rinconete y Cortadillo en Tormes||María Barragñan|Esphera Teatro||||||8c2c3ce0-5fef-4883-b62c-05bd42ab885e
315|Miguel de Cervantes|El licenciado Vidriera |8 de noviembre de 2009|Carlos Martín|Teatro del Temple||Centro Cívico Teodoro Sánchez Punter (Zaragoza)||41.6378108|-0.8728851|37fe8a04-ee29-47c7-86e6-b8d842bfa7a0
316|Miguel de Cervantes|Entremeses variados: La cueva de Salamanca; La guarda cuidadosa; Los habladores||dOMINGO Ortega|Sociedad Estatal de Servicios Culturales. SECC; Grupo de Teatro de la Universidad Carlos III||||||e850b8da-d284-43b0-8727-76b8ad072427
317|Miguel de Cervantes|Quijote||Simeón Spivak|Teatro de la Juventud de Fontanka||||||e4c9d3d5-302d-41fe-af80-44dcd185f39a
318|Miguel de Cervantes|Rinconete y Cortadillo; El licenciado Vidriera||Pepe Ortega|Ítaca Teatro||||||b4810de0-da8d-48de-ac19-ed6bb2b5062e
319|Miguel de Cervantes|Abrevia T|16 de marzo de 2010|Victor Manuel Dogar|Producciones Dogar||Teatro Bellas Artes (Madrid)||40.4183333|-3.6963889|37ee731c-cfb0-4742-98b1-38bbcd024313
320|Miguel de Cervantes|El coloquio de los perros|9 de octubre de 2010|Fefa Noia|Teatro de la Abadía|Semana Cervantina|Corral de Comedias, Alcalá de Henares (Madrid)||40.4822922|-3.3645504|b669931c-c223-4320-ac89-240ff4ba9f1f
321|Miguel de Cervantes|El imaginario de Cervantes|11 de septiembre de 2010|Sonia Sebastián|Teatro de Cámara Cervantes|Noche en Blanco|Sociedad Cervantina (Madrid)||40.411408|-3.6970031|2bbdecc5-c1e7-40fd-a580-7980b0f0564d
322|Miguel de Cervantes|El viejo celoso; El vizcaíno fingido; Entremeses de Cervantes; La cueva de Salamanca||Ernesto de Diego|Corrales de Comedias Teatro||||||1e757fce-fe8a-428b-9681-0410983ded7a
323|Miguel de Cervantes|Don Quijote||Meng Jinghui|Compañía Nacional de Teatro de China ||||||44a53cd1-079f-455f-88d6-dd4a1a9be9c7
324|Miguel de Cervantes|El coloquio de los perros|21 de enero de 2011|Francisco Negro|Morfeo Teatro Clásico||Teatro Principal de Burgos (Burgos)||42.3406276|-3.6998874|41070807-3d1e-4e36-8aa0-c63d5ee7a4df
325|Miguel de Cervantes|Entremeses: El vizcaíno fingido, El viejo celoso y La cueva de Salamanca||Alejandro Arestegui|Secuencia 3 Artes y Comunicació||||||ad008868-9058-4de2-a2c8-450982997f77
326|Miguel de Cervantes|Numancia |9 de abril de 2011|José Luis Arellano García|Joven Compañía de Teatro de Parla||Teatro de la Casa de la Juventud de Parla (Madrid)||40.23242|-3.7614235|c172d835-25bf-4903-8336-ea6b2b4e336b
327|Miguel de Cervantes|Cipión de Berganza (incluye los entremeses: El viejo celoso, El vizcaíno fingido y Los habladores)||Carlos Fernández de Castro|Tiempolírico||||||6c5ab773-d192-4840-9b9f-776a5a8e9c48
328|Miguel de Cervantes|Don Quijote|13 de diciembre de 2012|Ángel Gutierrez|Teatro de Cámara Chéjov|Festival UNIR Alumni|Sala Gonzalo de Berceo de Logroño (La Rioja)||42.464221|-2.4425784|1dd9c16f-ba31-48ec-99d0-3ab133e578ff
329|Miguel de Cervantes|El coloquio de los perros||Emilio del Valle|Producciones Inconstantes||||||2fcff17c-d6bb-49ff-a788-bd1f9d54d042
330|Miguel de Cervantes|El viejo celoso||Miguel Fresneda|Cambaluz Teatro||||||4c61526c-57e7-4737-a1ed-1d96eeefa008
331|Miguel de Cervantes|Entremeses|9 de noviembre de 2012|Del Colectivo|Zamamur Producciones ||Gran Teatro de Cáceres (Extremadura)||39.4731946|-6.3754623|18c4697f-a78d-42ae-9309-cc1e5b6240e4
332|Miguel de Cervantes|Gaudeamus||Jaime Santos|La Chana Teatro||||||1920bac0-5eb1-4068-905d-2d1061ba2536
333|Miguel de Cervantes|Don Quijote, Yo soy don Quijote, Yo soy Don Quijote de La Mancha|5 de julio de 2012|Luis Bermejo|Metrópolis Teatro|Festival de Teatro Clásico de Almagro|Antigua Universidad Renacentista de Almagro (Ciudad Real)||38.8915937|-3.7148261|623410e6-156e-464c-89b4-0fa39d3372b6
334|Miguel de Cervantes|El coloquio de los perros |26 de marzo de 2013|Ramón Fontserè|CNTC, Els Joglars||Teatro Pavón de Madrid||40.410031|-3.7061552|22fb1c19-1bb0-4401-a71f-d1c99f3a48ca
335|Miguel de Cervantes|El coloquio de los perros||Tagore González y David Orrico|Amanece Teatro||||||458e0da2-4b08-4417-ab83-131505f39962
336|Miguel de Cervantes|Don Quijote de la Mancha, Don Quijote|7 de abril de 2014|José Luis Gómez|Centro Dramático Nacional, CDN||Teatro Pavón de Madrid||40.410031|-3.7061552|7f010e32-458e-42fa-9a72-44b91eca619e
337|Miguel de Cervantes|El coloquio de los perros|17 de junio de 2014|Ma Zhenghong y Alejandro González Puche|Laboratorio Escénico Univalle|Festival Internacional de Teatro Clásico|Teatro Municipal de Almagro (Ciudad Real)||38.89053|-3.7119068|18d32a5b-7533-4340-979e-cbd6ac867456
338|Miguel de Cervantes|Entremeses: La cueva de Salamanca, El viejo celoso y El retablo de las maravillas||José Luis Gómez|Teatro de la Abadía|Festival Clásicos en Alcalá|||||bf25b88d-af40-4827-8bf9-b176b49cf32d
339|Miguel de Cervantes|Don Quijote, Las locas historias de Don Quijote de La Mancha|22 de diciembre de 2014|Eva Rodríguez|Universalmix teatro||Centro Cultural La Vaguada de Madrid||40.4794927|-3.709135|e01c0d55-5389-4ca8-8a37-fed9822685f2
340|Miguel de Cervantes|El cerco de Numancia|19 de agosto de 2015|Paco Carrillo|Verbo Producciones|Festival Internacional de Teatro Clásico|Teatro Romano de Mérida (Badajoz)||38.915402|-6.3389273|8ba57739-5600-4ca8-9809-d579a5008cda
341|Miguel de Cervantes|Don Quijote, El sueño del Quijote|18 de octubre de 2015|César Deneken|El Jinete Verde||Teatro Villamarta de Jerez de la Frontera (Cádiz)||36.6828855|-6.1352393|90e2c2ca-ad35-43ab-81c6-c1c1cfaa9a89
342|Miguel de Cervantes|Ingenius gentleman don Quixote of La Mancha||Ian Nicholson|Little Soldier Productions||||||cb26decd-b96a-43c8-9919-2695f5f386f5
343|Miguel de Cervantes|La española inglesa. Las dos doncellas; Novelas ejemplares||Gonzala Martín Scherman|Factoría Teatro S. L||||||eb1cf175-27d9-48de-8107-803526306a27
344|Miguel de Cervantes|Quijote, el vértigo de Sancho; Kixote;|9 de enero de 2015|José Ramón Martínez|Markeliñe||Zornotza Aretoa de Amorebieta-Etxano, Vizcaya (País Vasco)||43.2198301|-2.7319023|738cf6bc-8a94-47f3-bcce-6120a85e4135
345|Miguel de Cervantes|Quijote aventuras|14 de noviembre de 2015|Severiano García Noda|Delirium Teatro||Auditorio Capitol de Tacoronte, Sanra Cruz de Tenerife (Islas Canarias)||28.4776101|-16.4147621|bd67c147-b4b7-4e37-8d58-5201a4b7e28d
346|Miguel de Cervantes|El coloquio de los perros|26 de julio de 2016|Gastón Borges|Lacoz|Festival Almagro Off|Teatro La Veleta de Almagro (Ciudad Real)||38.8994072|-3.7079747|3ae963c0-57f8-48cd-87fc-7ac511aaf8aa
347|Miguel de Cervantes|El retablo de las maravillas|30 de enero de 2016|Francisco Negro|Morfeo Teatro Clásico||Teatro Principal de Burgos (Castilla y León)||42.3406276|-3.6998874|3edb349e-33bd-4289-9142-94189a04a4fa
348|Miguel de Cervantes|El viejo celoso||Adriano Iurissevich|Compañía Reymala||||||ea65b4af-3ce8-437f-9858-195e571f56a9
349|Miguel de Cervantes|La conquista de Jerusalén||Juan Sanz|Antiqua Escena||||||5ec8309f-eef5-48c2-8c43-a7adc9365229
350|Miguel de Cervantes|La gitanilla|26 de octubre de 2016|Paco Maciá|Arena Teatro; Compañía Ferroviaria|Festiva Medieval|Elche (Alicante)||38.2665289|-0.6896821|61416022-b340-4101-80c2-244cf196daf8
351|Miguel de Cervantes|Numancia|16 de abril de 2016|Juan Carlos Pérez de la Fuente|Teatro Español||Teatro Español (Madrid)||40.4149459|-3.7001863|20275e7f-5000-4fa7-aba7-c4beaa64b617
352|Miguel de Cervantes|Pedro de Urdemalas  |28 de julio de 2016|Denis Rafter|Joven Compañía Nacional de Teatro Clásico,  Compañía Nacional de Teatro Clásico (CNTC)|Festival Internacional de Teatro Clásico|Corral de Comedias de Almagro (Ciudad Real)||38.8884394|-3.7119119|d586394e-361b-4cb6-addf-cb836327688f
353|Miguel de Cervantes|Tratos|14 de septiembre de 2016|Ernesto Caballero|Centro Dramático Nacional, CDN||Centro Cultural Conde Duque (mADRID)||40.4274072|-3.7107195|84e1bada-976f-4ccd-ba5a-a210850ef83e
354|Miguel de Cervantes|Amors & Humors||Abel Folk y Pep Planas|Ilerda Antiqua||||||ef7f454b-d232-40af-86de-5c35f3a51d55
355|Miguel de Cervantes|Dos nuevois entremeses, nunca representados; La guada cuidadosa, El rufián viudo llamado Trampagos. |23 de noviembre de 2017|Ernesto Arias|Teatro de la Abadía||Sala Juan de la Cruz, Teatro de La Abadía (Madrid)||40.4353022|-3.7094283|2a027a43-a672-48ef-8c17-306061f79b19
356|Miguel de Cervantes|El rufián dichoso|13 de mayp de 2017|Rodrigo Arribas y Verónica Clausich|Fundación Siglo de Oro; Pentación, S.A; Pánico Escénico|Jornadas de Teatro del Siglo de Oro|Auditorio Municipal Maestro Padilla (Almería)||36.8236768|-2.4440319|ca5f505c-9213-4d2d-ada3-9fcaf26807e5
357|Miguel de Cervantes|Don Quijote somos todos|1 de noviembre de 2019|Carlos Martín|Teatro del Temple||Palacio de Congresos de Jaca, Huesca (Aragón)||42.5749251|-0.5466213|17b5ded8-e351-4a11-8413-d7aaf8813f96
358|Miguel de Cervantes|El coloquio de los perros. El casamiento engañoso. Novelas ejemplares. El coloquio de los perros. ||Emilio del Valle|Factoría Teatro S.L ||||||3350eca5-71a3-42fd-9d5f-e7dbcdd68290
359|Miguel de Cervantes|El licenciado Vidriera|18 de abril de 2019|Cristina D. Silveira|Karlik Danza Teatro; La Nave del Duende||La Nave del Deunde de Casar de Cáceres (Extremadura)||39.5525213|-6.4194535|30dd66bd-64a6-4a8a-b5c2-3f6946f1f3bf
360|Miguel de Cervantes|Microclásicos; El juez de los divorcios||Antonio León y Norton P|Corrales de Comedias S.L ||||||3bd6846c-f2a6-4f5f-ad98-1aa3885f52d0
361|Miguel de Cervantes|De cómo los entremeses de Cervantes no impidieron el casamiento de doña Catalina de Oviedo con el Gran Turco||Juan Mortera|Teatro Margen||||||e3580877-39e6-4964-bae6-3bae2e620554
362|Miguel de Cervantes|Diablos, brujas y granujas||Agustín Sasián|La Luciérnaga Producciones||||||4ba94ee8-1d93-4a15-961b-ccc5bc8a08f8
363|Miguel de Cervantes|Don Quijote y Perrisancho|10 de marzo de 2020|Belén Sánchez Vigo|Perripato & Compañía||Sala La Cochera Cabaret (Málaga)||36.6922645|-4.4509556|b846a2f5-62d4-4f69-8111-203be66cb225
364|Miguel de Cervantes|Ahora que nos dejan hablar|23 de enero de 2021|Álvaro Nogales|Mudanzas López, M. L. ||Corral de Comedias de Alcalá de Henares (Madrid)||40.4822922|-3.3645504|a9f864c7-b0e7-4778-a1fe-64a57907cfb0
365|Miguel de Cervantes|Numancia|12 de noviembre de 2021|Ana Zamora|Nao d´Amores,  Compañía Nacional de Teatro Clásico (CNTC)||Teatro Juan Bravo de Segovia (Castilla y León)||40.9504826|-4.1235423|11eb7dd2-2b9b-41bd-95af-e349f8518037
366|Miguel de Cervantes|El coloquio de las perras|8 de mayo de 2021|Hernán Gené|Estudio Hernán Gené||Corral de Cervantes (Plaza de toros) de Aranjuez (Madrid)||40.0278334|-3.6035532|5744710e-2401-4dc4-8112-5372f6ea2a00
367|Miguel de Cervantes|Muejres imaginadas en tiempos de Cervantes||Luis Alonso Prieto|Teatro Independiente Alcalaíno TIA||||||9ad50ff7-e3a6-47fb-a87c-d8b647d0b958
368|Miguel de Cervantes|Pr3cioxxa||Mario Marcol|Tío Venancio||||||41411b8f-bb32-4a8d-949b-26f0cfec6d7a
369|Miguel de Cervantes|Quixote; Quijote||Laura Sarasola|Pedras de Cartón||||||0b654db2-e162-4f6a-b323-2a5754c3195f
370|Miguel de Cervantes|La guarda cuidadosa; La cueva de Salamanca|19 de junio de 2022|Javier Mañón|Corrales de Comedias Teatro||Corral de Comedias de Alcalá de Henares (Madrid) ||40.4451582|-3.5339127|265c1165-159a-49de-9e90-c435927ff58f
371|Juan de la Cueva|El príncipe tirano|13 de julio de 2006|Pepa Gamboa|Centro Andaluz de Teatro, CAT y Teatro Lope de Vega |Festival Internacional de Teatro Clásico de Almagro |Teatro Municipal de Almagro, Ciudad Real (Castilla La Mancha)||38.8903455|-3.7117528|ca23586b-0919-49f3-8bf3-1b9d0085e41b
372|María de Zayas y Sotomayor|La traición en la amistad|10 de julio de 2003|Mariano de Paco Serrano |Mariano de Paco Serrano||Claustro Mudéjar de Chinchilla, Albacete (Castilla La Mancha)||38.9203448|-1.7256087|a431a982-bd24-4b33-97d5-7a976a8c6cd2
373|María de Zayas y Sotomayor|La traición en la amistad|16 de julio de 2019|Daniel Acebes|Diágoras Producciones|Festival de Teatro Clásico|Corrala Palacio del Caballero de Olmedo, Valladolid (Castilla y León)||41.2863196|-4.6859718|ddd91912-ff2f-4cef-87cf-220e295e9861
374|María de Zayas y Sotomayor|Traspiés. Palabra para (des)aparecer ||Del Colectivo|Colectivo La Matrioska ||||||c432ade7-5699-4bc5-a281-a1967581d143
375|María de Zayas y Sotomayor|Tan sabia como valerosa|26 de julio de 2020|Ignacio García|Instituto Cervantes|Festival Internacional de Teatro Clásico de Almagro |Corral de Comedias de Almagro, Ciudad Real (Castilla La Mancha)||38.8884394|-3.7119119|8a9047c5-548a-4c94-94a1-376d6a6936b2
376|María de Zayas y Sotomayor|Adiós, dueño mío o la tradición en la amistad|1 de mayo de 2021|Magüi Mira|Olympia Metropolitana S.A||Auditorio de Torrent, Valencia (Comunidad Valenciana)||39.4236513|-0.4801567|053e5c00-003c-45f3-9c4b-9750a8c1f744
377|María de Zayas y Sotomayor|Autorretratos de pluma y espada; Dramaturgias del barroco en primera persona ||Cristina S.Silveira|Karlik Danza Teatro|Festival de Teatro Clásico de Cáceres|||||0a28fb63-73f1-49b1-a433-74781a4da6ef
378|María de Zayas y Sotomayor|Bambi vs Godzsilla|30 de junio de 2022|Luis Tausía|Compañía del Tío Venancio |Festival Iberoamericano del Siglo de Oro Clásicos en Alcalá|Centro Cultural Gilitos de Alcalá, Madrid (Comunidad de Madrid)||40.4921751|-3.3666232|968a3ad9-8e58-41f6-9c38-0063d0d06093
379|María de Zayas y Sotomayor|La traición 60.3|19 de mayo de 2022|Cruz Hernández|Unatarde Teatro||Teatro Círculo de Valencia, Valencia (Comunidad Valenciana)||39.4852114|-0.3553528|ffff5a9c-05e7-4987-9cdf-5912c1e4ff8f
380|||||||||||a2779fea-b530-43b6-bae9-a175b91eec29
381|||||||||||8a71cc6c-fc28-4b2e-9ca7-dda697fed633
382|Lope de Rueda |Garnacho Bululo y Ñaque en la chanza del santero desollado, La carátula |1 de diciembre de 2001|Colectivo|El Capo Cómico||Calle Mayor de Alcalá de Henares, Madrid (Comunidad de Madrid)||40.4820847|-3.3669853|b2c23dfc-b232-442b-b997-d0dd389763f7
383|Lope de Rueda |La fiesta perpetua|19 de noviembre de 2003|Pilar Laveaga|Teatro de la Ribera||Teatro Principal de Zaragoza||41.6518556|-0.8793213|7b86a644-3a1c-455f-9d86-0884ed4d5683
384|Lope de Rueda |Historias de Martín de Villalba.||Etelvino Vázquez|Teatro del Norte||||||e04c3656-bbae-44a8-80b4-a9e00a4127a4
385|Lope de Rueda |El deleitoso y otras delicias||Agusíin Iglesias|Teatro Guirigai||||||d47d0511-2ac7-4e26-b047-afe9cc6ecabe
386|Lope de Rueda |Los cómicos de la legua||Domingo Torres|Uno teatro||||||868fc129-dc37-43c5-9d96-c8838640bc40
387|Lope de Rueda |Julia, Un viaje teatrástico|22 de marzo de 2012|Julio Fraga |Teatro Clásico de Sevilla ||Teatro Villa del Conocimiento y las Artes de Mairena del Alcor, Sevilla (Andalucía)||37.3752136|-5.748197|ab3be3df-e996-4bc8-92bf-ee5bdeb4fe52
388|Lope de Rueda |La corte de los bufones: paso a paso la comedia||José Uriel García Solís|La Gorgona Teatro||||||bd9f3f30-cb1a-4488-8606-703ec6ecec05
389|Lope de Rueda |Fiesta de farsantes. Tablado del mundo|2 de septiembre de 2021|Daniel Alonso de Santos|Pérez y Goldstein S.L; Okboomer.|Festival Clásicos en Alcalá|Teatros del Canal, Madrid (Comunidad de Madrid)||40.438279|-3.7051836|f4c71598-7631-42d6-8d27-7f779c224bb6
390|Lope de Rueda |La garnacha de los bufones||Javier Mañón|Corrales de Comedias ||||||569ee456-e9ff-4fed-95ab-a709e251d5c8
